NAME,FOREIGN NAME,CATEGORY
nissin demae ramen noodle w. soup base shrimp flavor (10 packs),日清 出前一丁 即食汤面 鲜虾味 (10包),Wholesale
nissin demae ramen noodle w. soup base xo seafood flavor (10 packs),日清 出前一丁 即食汤面 XO酱海鲜味 (10包),Wholesale
oishi potato chips tomato flavor - 80g (12 bag),上好佳 薯片 田园番茄味 80g (12包),Wholesale
oishi potatoe chips sweet & spicy - 80g (12 bag),上好佳 薯片 田园甜辣味 80g (12包),Wholesale
oishi prawn crackers - 40g (12 packs),上好佳 鲜虾条 40g (12包),Wholesale
oishi shrimp flakes - 40g (12 packs),上好佳 鲜虾片 40g (12包),Wholesale
onions - 5lb,洋葱 5lb,Wholesale
potatoes - 5lb,土豆 5lb,Wholesale
purple yams - 5lb,夏威夷紫薯 5lb,Wholesale
s&b golden curry sauce extra hot - 7.8oz (5 boxes),S&B 金牌咖喱块 特辣 (5盒) 7.8oz,Wholesale
s&b golden curry sauce medium hot - 7.8ml (5 boxes),S&B 金牌咖喱块 中辣 7.8ml (5盒),Wholesale
s&b golden curry sauce mild - 220g (5 boxes),S&B 金牌咖喱块 微辣 220g (5盒),Wholesale
shaomei ice cream bar brown sugar boba - 80g (6 pack),小美黑糖 珍奶雪糕 80g 6盒 (4包/盒),Wholesale
shin ramyun black box (24 per box),辛辣面 黑 (24包/箱),Wholesale
shin ramyun instant noodle (16 pc),辛拉面 红 (16包/箱),Wholesale
sunity herbal jelly red bean flavor (10 cups),生和堂 奶香红豆龟苓膏 (10杯),Wholesale
taisun mixed congee - 375g (24 per box),泰山八宝粥 375g (24罐/箱),Wholesale
unif assam green tea milk tea drink - 450ml (15 bottles),台湾统一阿萨姆 煎茶奶绿 (15瓶/箱),Wholesale
vita chrysanthemum tea - 250ml (24 packs),维他 菊花茶 250ml (24瓶）,Wholesale
vita lemon tea drink -250ml (24 packs),维他 柠檬茶 250ml (24盒),Wholesale
vita lychee juice 250ml (24 pack),维他 茘枝汁 250ml (24包）,Wholesale
vita mango juice drink - 250ml (24 packs),维他 芒果汁 250ml (24瓶）,Wholesale
vita soy malted soya drink - 250ml (24 packs),维他 麦精豆奶 250ml (24瓶）,Wholesale
vita soy milk chocolate flavor -250ml (24 packs),维他朱古力豆奶一箱（24瓶）,Wholesale
vita soymilk - 250ml (24 packs),维他豆奶 250ml (24瓶/箱),Wholesale
wahaha vitamin ad & calcium drink (24 per box),娃哈哈 AD钙奶饮品 (24瓶/箱),Wholesale
wei long da mian jin - 102g (10 packs),卫龙 大面筋辣条 102g (10包),Wholesale
wei long hot konjac spicy flavor (5 packs),卫龙 魔芋爽 香辣味 (5包),Wholesale
wong lo kat black herbal tea - 310ml (24 cans),王老吉 黑凉茶 310ml (24罐),Wholesale
xiao ming lemon tea (15 bottles),小茗同学 青柠红茶 (15瓶/箱）,Wholesale
xiao ming liuliu tea drink (15 per box),小茗同学 溜溜哒茶 (15瓶/箱）,Wholesale
xinyuanzhai osmanthus plum juice (12 count),信远斋 酸梅汤饮料 (12瓶),Wholesale
yeshu coconut drinks (30 cans),椰树牌 椰汁 (30罐),Wholesale
zucchini - 4lb,西葫芦 4lb,Wholesale
alari corn noodle - 400g,阿拉里 玉米面条 400g,Dry Goods & Ramen
asian taste bean curd stick,东之味 圆枝腐竹,Dry Goods & Ramen
asian taste sour mustard -10.5oz,东之味 酸菜 10.5oz,Dry Goods & Ramen
asian taste sweet rice - 5lb,东之味 长糯米,Dry Goods & Ramen
bai jia a kuan instant noodle sweet spicy flavor,白家阿宽成都甜水面 袋裝,Dry Goods & Ramen
bai xiang crawfish lo mein,白象 大辣娇小龙虾拌面,Dry Goods & Ramen
bai xiang instant noodle chicken soup flavor,白象汤好喝 老母鸡汤味面,Dry Goods & Ramen
bai xiang instant noodle pork bone soup flavor,白象汤好喝 招牌猪骨汤味面,Dry Goods & Ramen
bai xiang instant noodle spicy beef flavor -111g (5 packs),白象汤好喝 辣牛肉汤面 111g (5包),Dry Goods & Ramen
botan calrose rice - 15lb,富贵花米 15lb,Dry Goods & Ramen
calbee frugra fruit & granola cereal original flavor - 482g,卡乐比 营养水果谷物麦片 原味 482g,Dry Goods & Ramen
calbee frugra fruit & granola cereal reduced sugar 15oz,卡乐比 营养水果谷物麦片 低糖 15oz,Dry Goods & Ramen
canned coconut milk,泰国椰奶 400ml,Dry Goods & Ramen
canned sardine - 5.5oz,灌装沙丁鱼 155g,Dry Goods & Ramen
canned sweetened red bean,小仓红豆,Dry Goods & Ramen
chin yeh fried gluten - 200g,台湾青叶 面筋 200g,Dry Goods & Ramen
chinese wolfberry - 227g,有机宁夏枸杞 227g,Dry Goods & Ramen
da han kou noodle hunan spicy (4 packs),大汉口 湘辣味热干面 (4包),Dry Goods & Ramen
da han kou noodle original flavor (4 pc),大汉口 热干面 原味 (4包),Dry Goods & Ramen
da jia japanese ramen - 600g,大甲 日式拉面 600g,Dry Goods & Ramen
da jia sliced noodles,大甲 刀削麵,Dry Goods & Ramen
da jia stirred noodles extra hot & spicy,大甲干面 地狱椒麻,Dry Goods & Ramen
da jia stirred noodles spicy & sesame flavor,大甲干面 劲辣麻酱,Dry Goods & Ramen
dongguan rice vermicelli,东莞米粉,Dry Goods & Ramen
dragon brand sweet potato vermicelli - 12oz,龙牌 红薯宽粉/粉条 12oz,Dry Goods & Ramen
dragon fine egg noodle - 16oz,龙牌 鸡蛋面 (幼) 16oz,Dry Goods & Ramen
dried woodear mushrooms,特级黑木耳,Dry Goods & Ramen
eggs quail in brine,罐装鹌鹑蛋,Dry Goods & Ramen
elephant scented rice - 25lb,美象牌 茉莉香米 25lb,Dry Goods & Ramen
fan sao guang crisp woodear mushrooms -280g,饭扫光 爽脆黑木耳 280g,Dry Goods & Ramen
fan sao guang enoki mushroom pickles - 280g,饭扫光 爆炒金针菇 280g,Dry Goods & Ramen
fan sao guang preserved bamboo shoot sauce - 280g,饭扫光 爆炒竹笋 酱香味 280g,Dry Goods & Ramen
fan sao guang preserved bamboo shoot spicy & hot - 280g,饭扫光 爆炒竹笋 香辣味 280g,Dry Goods & Ramen
fan sao guang preserved savory mushrooms spicy & hot - 280g,饭扫光 爆炒香菌 香辣味 280g,Dry Goods & Ramen
fan sao guang preserved savory woodear mushrooms - 280g,饭扫光 爆炒香菌 酱香味 280g,Dry Goods & Ramen
fortune mushroom slices - 53 oz,FORTUNE 磨菇片 53oz,Dry Goods & Ramen
fresh way soybean roll best for hot pot or hot soup - 168g (14 pc),鲜道 响铃卷 168g (14条/盒),Dry Goods & Ramen
fried dace w. black beans,鹰金钱 豆豉鲮鱼,Dry Goods & Ramen
golden elephant thai rice - 20lb,金象 泰国香米 20lb,Dry Goods & Ramen
green mountain brown rice - 4.4lb,绿山糙米 4.4lb,Dry Goods & Ramen
guangyou chongqing instant noodle beef flavor - 420g,光友 重庆小面 牛肉味 420g,Dry Goods & Ramen
havista brown sugar - 16oz,五谷丰 保健红糖 454g,Dry Goods & Ramen
havista chongqing traditional noodle,五谷丰 重庆小面,Dry Goods & Ramen
havista dongbei dried noodle - 31.7oz,五谷丰 新鲜东北大拉皮 900g,Dry Goods & Ramen
havista shaanxi dried noodle - 1100g,五谷丰 陕西扯面 1100g,Dry Goods & Ramen
havista shanghai yangchun noodles - 38.8oz,五谷丰 上海阳春面 1100g,Dry Goods & Ramen
havista shanxi noodle - 38.8oz,五谷丰 山西刀削面 1100g,Dry Goods & Ramen
hehuan bean threads - 300g,合欢牌 宽条粉丝/宽粉 300g,Dry Goods & Ramen
itauki hakata osshol ramen - 104g,日本博多 猪骨风味拉面 104g,Dry Goods & Ramen
itsuki kumamon no kumamoto ramen,熊本熊 猪骨拉面,Dry Goods & Ramen
j-basket japanese somen noodle - 28.21oz,日本 上州素面 28.21oz,Dry Goods & Ramen
jb sanma kabayaki saury,日式浦烧秋刀鱼,Dry Goods & Ramen
jiang hu hot & sour noodle cup - 138g,江湖 酸辣粉 138g,Dry Goods & Ramen
jjajang topokki rice cake,韩国炒年糕 炸酱味,Dry Goods & Ramen
kang ya ku konjac powder - 40g,康雅酷 冰粉粉创意DIY甜品 原味 40g,Dry Goods & Ramen
kiki just noodle green onion flavor,台湾Kiki 葱油拌面,Dry Goods & Ramen
kiki just noodle spicy & vinegar flavor,台湾Kiki 老醋辣面,Dry Goods & Ramen
kiki just noodle szechuan spicy flavor - 450g,台湾Kiki 椒麻拌面 450g,Dry Goods & Ramen
kokuho rose original sushi rice - 15 lbs,红国宝白米 15lbs,Dry Goods & Ramen
li zi qi instant noodle chili oil flavor,李子柒 红油面皮,Dry Goods & Ramen
li zi qi instant noodle szechwan pepper flavor,李子柒 椒麻宽面,Dry Goods & Ramen
liang cheng mei biang biang noodles - 255g,良呈美 BiangBiang面 255g,Dry Goods & Ramen
lin sheng ji black sesame & black bean powder,林生记 芝麻黑豆粉,Dry Goods & Ramen
liu po hotpot condiment - 580g (serves 4-6),六婆 火锅底料 半固态复合调味料 580g 4-6人食用,Dry Goods & Ramen
liu yi shou handmade hotpot condiment medium spicy - 500g,重庆刘一手 手工牛油火锅底料 中辣 2-4人份 500g,Dry Goods & Ramen
long kou vermicelli - 500g,龙口粉丝 500g,Dry Goods & Ramen
lotus seed 10oz,莲子 10oz,Dry Goods & Ramen
luo ba wang instant rice noodle tomato flavor,螺霸王 螺蛳粉 番茄味,Dry Goods & Ramen
marukome fd miso tofu soup (serves 3),Marukome 豆腐味增汤 3人份,Dry Goods & Ramen
nishiki healthy brown rice - 15lb,养生玄米 15lb,Dry Goods & Ramen
noodle garden shanghai yangchun noodles - 4lb,面香源 上海阳春面 4lb,Dry Goods & Ramen
noodle garden tomoshiraga somen noodles - 4lb,面香源友 白发素面 4lb,Dry Goods & Ramen
oriental masco luncheon meat - 340g,吉祥牌 午餐肉 340g,Dry Goods & Ramen
qian fen xi shi xin jiang noodles mild spicy 250g,千粉西施 新疆特色炒米粉 微辣 250g,Dry Goods & Ramen
ra farm luncheon meat,中华午餐肉,Dry Goods & Ramen
shi zu ren sesame noodles,食族人 麻酱面皮,Dry Goods & Ramen
shin ramyun black (4 pack),辛辣面 黑 (4包),Dry Goods & Ramen
shin ramyun red (4 pc),辛拉面 红 (4包),Dry Goods & Ramen
spicy king shreded preserved vegetable - 100g,川霸王 袋装榨菜丝 麻辣味 100g,Dry Goods & Ramen
spicy king shreded preserved vegetable spicy & sour flavor - 100g,川霸王 袋装榨菜丝 酸辣味 100g,Dry Goods & Ramen
sweet glutinous rice - 5lb,红梅糯米 - 5磅,Dry Goods & Ramen
three horses thai sweet rice - 25lb,三马 糂米/糯米 25lb,Dry Goods & Ramen
twin marquis hongkong style pan fried noodles - 454g,真味 港式炒面 454g,Dry Goods & Ramen
vegetarian pepper flavor meal kit,袁鲜 藤椒钵钵鸡,Dry Goods & Ramen
wei long konjac vermicelli hot & sour flavor - 301g,卫龙 酸辣魔芋粉 301g,Dry Goods & Ramen
wei-chuan organic millet - 396g,味全 有机小米 396g,Dry Goods & Ramen
xiangnian spring onion noodle - 276g (serves 2),想念 葱油拌面 两人份 内附酱料 276g,Dry Goods & Ramen
xiangnian wuhan instant noodle (serves 2),想念 热干面 两人份 内附酱料,Dry Goods & Ramen
yamamoto spicy mixed ramen (serves 2),山本辣拌拉面 (2人份),Dry Goods & Ramen
yangchen cordyceps flower dried - 100g,养辰 虫草花干 100g,Dry Goods & Ramen
yellow kokuho rice - 15lb,黄国宝白米 15lb,Dry Goods & Ramen
yuan xian vegetarian spicy flavor meal kit,袁鲜 红油方便钵钵鸡,Dry Goods & Ramen
zhu da fu grill cold noodles - 615g,朱大福 烤冷面 615g (附带烧烤调料/烤冷面酱/刷子),Dry Goods & Ramen
aged vinegar - 500ml,老陈醋 500ml,Pantry
asian taste vegetable oil - 48oz,东之味 菜油,Pantry
bear coming new orleans marinade honey flavor,小熊驾到 新奥尔良烤翅 蜜汁味,Pantry
bear coming new orleans marinade spicy flavor,小熊驾到 新奥尔良烤翅调料 微辣,Pantry
black garlic - 250g,阜盈黑蒜 248g,Pantry
black melon seeds,黑瓜子,Pantry
canadian pure natural honey,加拿大 纯正蜂蜜,Pantry
chan & chan chinese brand sausage,喜上喜 汾酒切肉肠,Pantry
cinnamon (1 bag),桂皮 (1袋),Pantry
cui hong chili powder,翠宏老味干碟,Pantry
cumin (1 bag),精选孜然粒 (1包),Pantry
de zhuang braised pork seasoning - 5.29oz,德庄 秘制红烧牛肉调料 150g,Pantry
de zhuang hot pot base 75,德庄 清油麻辣火锅底料75,Pantry
de zhuang hot pot base mushroom flavor - 5.29oz,德庄 牛肝菌菌汤火锅底料 150g,Pantry
de zhuang hot pot soup base -7.76oz,德庄 清油麻辣火锅底料65 220g,Pantry
de zhuang hot pot soup base 52 degree spicy - 7.76oz,德庄 清油麻辣火锅底料 52度辣 220g,Pantry
de zhuang hot pot soup base savory taste - 7.76oz,德庄 三鲜火锅底料 220g,Pantry
de zhuang hot pot soup base tomato flavor - 7.76oz,德庄 番茄火锅底料 220g,Pantry
de zhuang mala hot pot soup base - 7.76oz,德庄 清油麻辣火锅底料45 220g,Pantry
dezhuang beef maw & pork blood seasoning - 5.64oz,德庄 毛血旺调料 160g,Pantry
dried whole mackerel fried fish,珠江桥牌 鲜炸鲮鱼,Pantry
fan sao guang brickle radish - 280g,饭扫光 脆萝卜 280g,Pantry
fan sao guang preserved bamboo shoot - 280g,饭扫光 野竹笋 280g,Pantry
fan sao guang preserved mushroom - 280g,饭扫光 野香菌 280g,Pantry
gas (4 pc),煤气 (4罐),Pantry
glutinous rice flour,糯米粉,Pantry
gold plum chinkiang vinegar,金梅牌 镇江香醋 550ml,Pantry
goldon lion dried star anise - 12oz,金狮牌 大红八角 12oz,Pantry
guangming preserved duck egg - 375g (6 packs),光阳 无铅海鸭皮蛋 375g 六只装,Pantry
haday excellent dark soy sauce - 500ml,海天牌 老抽王 500ml,Pantry
haday premium seasoned soy sauce - 500ml,海天牌 一品鲜酱油 500ml,Pantry
haday premium soy sauce - 1.9l,海天牌 味极鲜酱油 1.9L,Pantry
haday premium soy sauce - 750ml,海天牌 味极鲜酱油 750ml,Pantry
haday signature oyster sauce - 720g,海天 招牌蚝油 720g,Pantry
haday soy bean sauce - 11.9oz,海天牌 招牌黄豆酱 340g,Pantry
haday superior light soy sauce - 500ml,海天牌生抽王 (500ml),Pantry
haday tasty seafood flavored soy sauce - 500ml,海天牌 海鲜酱油 500ml,Pantry
haidilao boiled fish seasoning,海底捞 精品水煮鱼调味料,Pantry
haidilao hot pot seasoning spicy flavor,海底捞 浓香牛油火锅底料,Pantry
haidilao hotpot seasoning (butter flavor),海底捞 浓香牛油火锅底料,Pantry
haidilao hotpot seasoning broth flavor,海底捞 清汤火锅汤料,Pantry
haidilao hotpot seasoning mushroom flavor,海底捞 菌汤火锅汤料,Pantry
haidilao hotpot seasoning shrimp flavor,海底捞 上汤三鲜火锅底料,Pantry
haidilao hotpot seasoning tomato flavor,海底捞 番茄火锅底料,Pantry
haidilao pickled cabbage seasoning,海底捞 精品酸菜鱼调味料,Pantry
haidilao sea fishing eating oatmeal green pepper sauce - 7.4oz,海底捞 燕麦青椒佐餐酱 210g,Pantry
haidilao soybean sauce,海底捞 红葱黄豆佐餐酱,Pantry
haidilao spicy sauce for crawfish - 200g,海底捞 麻辣小龙虾调味料 200g,Pantry
haidilao spicy sauce for stir fry - 7.8oz,海底捞 麻辣香锅调味料 110g,Pantry
haitian soy sauce for steamed fish,海天牌蒸鱼豉油,Pantry
hanasia gochujang hot pepper paste,韩亚 韩囯辣豆瓣酱,Pantry
hong ya dong hot pot soup base double flavor - 400g,洪崖洞 鸳鸯火锅底料 400g,Pantry
house wasabi paste - 1.5oz,house 芥末 1.5oz,Pantry
huy fong ghili garlic sauce - 18oz,汇丰 蒜蓉辣椒酱 18oz,Pantry
huy fong sriracha sauce - 17oz,汇丰 是拉差香甜辣椒酱 17oz,Pantry
jin rui yi black sesame powder,金瑞益 黑芝麻粉,Pantry
kadoya pure sesame oil - 56oz,Kadoya 纯净上等麻油 56oz,Pantry
kadoya sesame oil - 11oz,八角 麻油 11oz,Pantry
kiki hot sauce,台湾Kiki 麻辣酱,Pantry
kikkoman soy sauce - 3.79l,万字酱油 (大),Pantry
kikkoman steak sauce,KIKKOMAN万字牌 牛排酱汁,Pantry
kikkoman teriyaki sauce honey & pineapple flavor,KIKKOMAN万字牌 照烧汁 含蜂蜜和菠萝,Pantry
kimbo taiwan rice bread powder - 500g,金宝台湾 发糕粉 550g,Pantry
kimchi,韩国泡菜,Pantry
korean bbq sauce (bulgogi) - 29.63oz,韩国烧烤酱 (Bulgogi) 29.63oz,Pantry
korean bbq sauce (kalbi) - 29.63oz,韩国烧烤酱 (Kalbi) 29.63oz,Pantry
lao gan ma chili oil sauce,老干妈 风味油辣椒,Pantry
lao gan ma chili oil w. black bean,老干妈 风味豆豉 油制辣椒,Pantry
lao gan ma hot chili sauce,老干妈 辣三丁油辣椒,Pantry
lao gan ma hot crispy sauce - 210g,老干妈 香辣脆 210g,Pantry
lee kum kee peppercorn chili oil - 115ml,李锦记 花椒辣椒油 115ml,Pantry
lion & globe pure peanut oil - 900ml,狮球唛 纯正花生油 900ml,Pantry
little sheep hot pot soup base - 235g,小肥羊 火锅底料辣汤 235g,Pantry
liu yi shou hot pot base - 200g,刘一手 老火锅底料 200g,Pantry
liubiju cucumber sauce - 250g,六必居 甜酱黄瓜 250g,Pantry
liubiju preserved hot vegetable - 290g,六必居 北京辣菜 290g,Pantry
liubiju sesame paste - 300g,六必居 混合芝麻酱 300g,Pantry
liupo qingyou hotpot soup base,六婆 清油火锅底料,Pantry
luncheon meat ham & pork - 340g,金华 火腿午餐肉 340g,Pantry
mae ploy sweet chili sauce,Mae Ploy 甜酸辣酱,Pantry
mi po po glutinous rice,米婆婆 甜酒酿,Pantry
mogami sweetened condensed creamer,最上炼奶,Pantry
moral villages hot pot seasoned oil - 60g,德庄 火锅专用油碟 60g,Pantry
moral villages pickled cabbage fish seasoning,德庄 老坛酸菜鱼调料,Pantry
ningjin red soup hotpot base - 300g,宁记 红汤火锅底料 300g,Pantry
niutou sa-teh sauce,牛头牌 沙茶酱 (大),Pantry
roasted white sesame - 8oz,特级白芝麻 8oz,Pantry
s&b golden curry sauce extra hot - 7.8oz (5 boxes),S&B 金牌咖喱块 特辣 7.8oz,Pantry
s&b golden curry sauce mild - 220g,S&B 金牌咖喱块 微辣 220g,Pantry
s&b shichimi togarashi 0.52g,S&B 七味粉 0.52g,Pantry
salt,盐,Pantry
san wu hot pot soup base - 150g,三五 火锅料 150g,Pantry
sesame sauce - 16.2oz,明德 芝麻酱,Pantry
shaosing cooking wine,绍兴特级厨用料酒 花雕酒,Pantry
spicy king shredded radish hot 400g,川霸王袋装搾菜丝（辣味）,Pantry
spicy king shredded radish original flavor - 400g,川霸王 袋装榨菜丝 原味 400g,Pantry
spicy king sichuan sauce for spicy dishes - 12.3oz,川霸王 川味炒菜酱料 2号麻辣型 350g,Pantry
sugar - 4lb,白砂糖 4lb,Pantry
three crabs fish sauce,Three Crabs 鱼露,Pantry
tian cheng red beans - 340g,天成 天津红豆 340g,Pantry
tian chu soybeans - 2lb,天厨 大黄豆 2lb,Pantry
tiancheng brown sugar,天成 纯正红糖,Pantry
tiancheng dried chili - 9oz,天成 辣椒干 9oz,Pantry
tiancheng green beans - 340g,天成 绿豆,Pantry
tiancheng pepper,天成 青花椒,Pantry
tying twine (4 ply),粽绳 (1盒),Pantry
wang shou yi thirteen flavor seasoning,王守义十三香,Pantry
wang zhihe rose fermented bean curd,王致和玫瑰腐乳,Pantry
wangzhihe preserved bean curd - 240g,王致和 香辣腐乳 240g,Pantry
wei-chuan mung bean - 396g,味全 绿豆 396g,Pantry
wheat flour - 5.5lb,富强粉/面粉 髙筋/饺子面条专用,Pantry
white sesame (1 bag),品牌白芝麻 (1包),Pantry
xin he onion mate soybean paste - 800g,欣和 葱伴侣 六月香黄豆酱 800g,Pantry
xin he sweet bean sauce - 800g,欣和 葱伴侣 六月香甜面酱 800g,Pantry
yuna&lynn extra virgin avocado oil - 500ml,Yuna&Lynn 特级初榨牛油果油 500ml,Pantry
zhuang yuan boiled salted duck egg - 288g (4 pc),庄园 熟咸蛋 288g (4个),Pantry
zhuang yuan preserved duck eggs - 272g(4 pc),庄园 糖心松花皮蛋 272g,Pantry
ai shang shrimp chips braised beef flavor - 180g,爱尚 咪咪虾条 红烧牛肉味 180g,Snacks & Desserts
ai shang shrimp chips original flavor - 180g,爱尚 咪咪虾条 原味 180g,Snacks & Desserts
ai shang shrimp chips spicy crawfish flavor - 180g,爱尚 咪咪虾条 麻辣小龙虾味 180g,Snacks & Desserts
aji cake hokkaido milk flavor - 330g,AJI 长崎蛋糕 北海道牛奶味 330g,Snacks & Desserts
aji cake matcha flavor - 330g,AJI长崎蛋糕 清新抹茶味 330g,Snacks & Desserts
aji cake yogurt flavor - 330g,AJI 长崎蛋糕 乳酸味 330g,Snacks & Desserts
akai bohshi purple box (16 pc),红帽子 法式饼干礼盒 紫色 (16片),Snacks & Desserts
ban duo le squid snack hot & spicy flavor - 20g,拌多乐 鱿鱼海鲜零食 麻辣味 20g,Snacks & Desserts
ban duo le squid snack original flavor - 20g,拌多乐 鱿鱼海鲜零食 原味 20g,Snacks & Desserts
ban duo le squid snack sweet spicy flavor - 20g,拌多乐 鱿鱼海鲜零食 甜辣味 20g,Snacks & Desserts
billionaire sun cake - 6.7oz (5 pc),亿万两 太阳饼 190g (5个),Snacks & Desserts
billionaire tamba cake,亿万两 御丹波,Snacks & Desserts
bourbon chocolate chip cookies,Bourbon 巧克力曲奇饼干,Snacks & Desserts
bourbon every burger cookie - 66g,日本布尔本 汉堡饼干 66g,Snacks & Desserts
calbee corn cracker eel kabayaki flavor - 80g,卡乐比 栗一烧 蒲烧鳗鱼味 80g,Snacks & Desserts
calbee corn cracker garlic flavor - 80g,卡乐比 栗一烧 烧蒜味 80g,Snacks & Desserts
calbee corn cracker lobster flavor - 80g,卡乐比 栗一烧 龙虾味 80g,Snacks & Desserts
calbee corn cracker mala spicy flavor - 80g,卡乐比 栗一烧 麻辣味 80g,Snacks & Desserts
calbee corn cracker spicy flavor - 80g,卡乐比 栗一烧 香辣味 80g,Snacks & Desserts
calbee potato chips honey butter - 80g,卡乐比 薯片 蜂蜜黄油味 80g,Snacks & Desserts
calbee potato chips hot & spicy flavor 80g,卡乐比 热浪薯片 辣味 80g,Snacks & Desserts
calbee potato chips pizza flavor 63g,卡乐比 薯片 披萨味 63g,Snacks & Desserts
calbee potato chips salt & seaweed flavor - 80g,卡乐比 薯片 海盐味 80g,Snacks & Desserts
chacha sunflower seed pecan flavor - 108g,洽洽 海盐瓜子 108g,Snacks & Desserts
chacha sunflower seed pecan flavor - 160g,洽洽 山核桃瓜子 160g,Snacks & Desserts
chacha sunflower seeds - 285g,洽洽 原味瓜子 285g,Snacks & Desserts
chaffle bread yogurt flavor,爱乡亲华夫面包 乳酪味,Snacks & Desserts
chang song biscuit milk flavor - 230g,台湾长松 鲜奶棒 230g,Snacks & Desserts
changsong biscuit chocolate flavor - 230g,台湾长松 巧克力棒 230g,Snacks & Desserts
chao you wei cake milk tea flavor - 180g,超友味 珍珠奶茶蛋糕 180g,Snacks & Desserts
crave natural adzuki bean oatmeal - 1.8oz,红豆枸杞枣粥,Snacks & Desserts
crave natural black sesame oatmeal,黑芝麻杂粮糊,Snacks & Desserts
crave natural holiday basket,Crave Natural 醇香低糖燕麦粥 节日大礼盒,Snacks & Desserts
crave natural silk osmanthus oatmeal,Crave Natural 桂花豆奶麦片,Snacks & Desserts
crave natural taro black tea oatmeal,Crave Natural 香芋红茶麦片,Snacks & Desserts
crave natural variety pack oatmeal -1.8oz (4 cups),Crave Natural 健康低糖燕麦粥 1.8oz (4杯),Snacks & Desserts
da li yuan egg pie strawberry flavor - 25g,达利园 注心派 草莓味 25g,Snacks & Desserts
da zhang fei rice cracker five spice flavor,大张飞 好巴来巴小米锅巴 五香味,Snacks & Desserts
da zhang fei rice cracker spicy flavor - 105g,大张飞 好巴来巴小米锅巴 麻辣味 105g,Snacks & Desserts
daiichi pan mini custard bread (7 pc),Daiichi 夹心小面包 (7个),Snacks & Desserts
dao xiang cun bread twist sesame flavor,稻香村 芝麻麻花,Snacks & Desserts
dorayaki japanese pancakes w. sweet red bean - 9.87oz,Dorayaki 红豆铜锣烧 9.87oz,Snacks & Desserts
formosa pork sung - 18oz,宝岛肉酥 18oz,Snacks & Desserts
fu wei handmade twisted roll brown sugar flavor,福味 手工麻花卷 黑糖,Snacks & Desserts
fupi beancurd skin crisps hotpot tomato flavor,新加坡FUPI 豆皮脆 番茄火锅味,Snacks & Desserts
fupi beancurd skin crisps mala flavor,新加坡FUPI 豆皮脆 四川麻辣味,Snacks & Desserts
ga ga zui fish tofu bbq flavor - 22g (30 packs),嘎嘎嘴 鱼豆腐 烧烤味 22g (30包),Snacks & Desserts
ga ga zui fish tofu crab flavor - 22g (30 packs),嘎嘎嘴 鱼豆腐 蟹香味 22g (30包),Snacks & Desserts
ga ga zui fish tofu spicy flavor (30 pack),嘎嘎嘴 鱼豆腐 香辣味 (30包),Snacks & Desserts
gagazui braised lotus roots,嘎嘎嘴 卤藕片,Snacks & Desserts
gagazui braised seaweed spicy flavor - 33g (33 count),嘎嘎嘴卤海带 香辣味 33g (30包),Snacks & Desserts
gan yuan roasted beans crab flavor,甘源牌 蟹黄味蚕豆,Snacks & Desserts
gan yuan sunflower seeds crab flavor,甘源 蟹黃味瓜子仁,Snacks & Desserts
garton wafers coconut flavor,嘉顿 威化饼 椰香口味,Snacks & Desserts
ginbis animal biscuits butter flavor - 50g,GINBIS金必氏 愉快动物饼干 黄油味 50g,Snacks & Desserts
ginbis animal biscuits coconut flavor - 50g,GINBIS金必氏 愉快动物饼干 椰香味 50g,Snacks & Desserts
ginbis dream animal biscuits seaweed flavor - 50g,GINBIS金必氏 愉快动物饼干 海苔味 50g,Snacks & Desserts
glico pocky almond crush chocolate sticks,固力果杏仁粒棒,Snacks & Desserts
glico pocky chocolate flavor,固力高 巧克力棒,Snacks & Desserts
glico pocky strawberry flavor,固力高草莓棒,Snacks & Desserts
green town northeastern pancake millet flavor - 220g,格林小镇 东北煎饼 小米口味 220g,Snacks & Desserts
green town northeastern pancake whole gain flavor - 220g,格林小镇 东北煎饼 五粮口味 220g,Snacks & Desserts
guan yi de black cookies - 308g,冠易德 黑金饼 308g,Snacks & Desserts
hapi bing bing cone snack strawberry fillings,冰淇淋饼干 草莓味,Snacks & Desserts
hapi bing bing cone snack w. chocolate fillings,冰淇淋饼干 巧克力味,Snacks & Desserts
hapi dry roasted edamame,Hapi 干毛豆,Snacks & Desserts
hapi ice cream cone snack green tea flavor - 2.5 oz (8 pc),Hapi 冰淇淋饼干 抹茶味 2.5oz (8个/盒),Snacks & Desserts
hapi mixed crackers snack,Hapi 什锦饼干零食,Snacks & Desserts
haw flakes,菊花山楂饼,Snacks & Desserts
hong kong runzhi crispy fish skin salted egg yolk flavor - 50g,香港润志 香脆鱼皮 咸蛋黄味 50g,Snacks & Desserts
huang fei hong peanut - 210g,黄飞红 香辣麻辣花生 210克,Snacks & Desserts
huierkang peanut milk drink - 365g,惠尔康 牛奶花生 365g,Snacks & Desserts
i mei frozen cheesecake - 400g,义美 芝士蛋糕 400g,Snacks & Desserts
i mei frozen chocolate cake - 14.11oz,义美 巧克力蛋糕 14.11oz,Snacks & Desserts
i mei frozen honey cake - 400g,义美 蜂蜜蛋糕 400g,Snacks & Desserts
i mei puff custard pudding family size (3 pc),台湾IMEI义美 小泡芙 鸡蛋布丁味 (3包),Snacks & Desserts
i mei puff lemon flavor (3 pc),台湾IMEI义美 小泡芙 柠檬味 (3包),Snacks & Desserts
i mei puff milk flavor - 65g (3 packs),台湾IMEI义美 小泡芙 牛奶味 65g (3包),Snacks & Desserts
