NAME,FOREIGN NAME,CATEGORY
imei puff strawberry flavor (3 pc),台湾IMEI义美 小泡芙 草莓味 (3包),Snacks & Desserts
jing yi zhen red sugar sachima - 608g,精益珍 红糖沙琪玛 608g,Snacks & Desserts
kanro pure gummy grape flavor,KANRO PURE果肉果汁咀嚼弹力软糖 葡萄味,Snacks & Desserts
kasugai green peas & beans,春日井芥末什锦豆,Snacks & Desserts
kasugai peanuts - 2.01oz,春日井什豆子 2.01oz,Snacks & Desserts
kitkat ocean salt chocolate - 150g,雀巢海盐巧克力 150g,Snacks & Desserts
korean traditional seasoned seaweed original flavor (3 pc),韩国原味海苔 (3包入),Snacks & Desserts
korean traditional seasoned seaweed wasabi flavor (3 pc),韩国海苔 芥末味 (3包),Snacks & Desserts
kotobuki pancake sweet bean chestnuts flavor,北海道 栗子铜锣烧,Snacks & Desserts
kou show spicy peanuts - 150g,口水族 川香麻辣花生 150g,Snacks & Desserts
lays chips cucumber flavor - 70g,乐事 薯片 黄瓜味 70g,Snacks & Desserts
lays chips original flavor - 70g,乐事 薯片 经典原味 70g,Snacks & Desserts
lays chips wasabi flavor - 70g,乐事 薯片 芥香味 70g,Snacks & Desserts
lays potato chips black pepper flavor - 104g,乐事 薯片 黑椒牛扒味 104g,Snacks & Desserts
lays potato chips rich fragrant toffee flavor - 70g,乐事 薯片 香浓奶糖味 70g,Snacks & Desserts
lays potato chips spicy crayfish flavor - 70g,乐事 薯片 香辣小龙虾味 70g,Snacks & Desserts
lays potato chips tomato flavor - 70g,乐事 薯片 真浓番茄味 70g,Snacks & Desserts
lays yam crisps cucumber flavor - 80g,乐事 山药薄片 清新黄瓜味 80g,Snacks & Desserts
lays yam crisps tomato flavor - 80g,乐事 山药薄片 田园番茄味 80g,Snacks & Desserts
le jin ji yogurt fillings bread - 380g,乐锦记 乳酪软心面包 380g,Snacks & Desserts
le zi delicious mini twist brown sugar flavor,乐滋 口水小麻花 黑糖味,Snacks & Desserts
le zi delicious mini twist honey flavor,乐滋 口水小麻花 蜂蜜味,Snacks & Desserts
le zi delicious mini twist sesame flavor,乐滋 口水小麻花 芝麻味,Snacks & Desserts
lipo cream egg cookies butter flavor,越南LIPO利葡 香酥面包干 黄油味,Snacks & Desserts
liziqi nuts lotus root starch - 350g,李子柒 桂花坚果藕粉 350g,Snacks & Desserts
lotte chocolate green tea pie,乐天 绿茶巧克力派,Snacks & Desserts
lotte chocolate pie,乐天 巧克力派,Snacks & Desserts
lotte custard cream cakes (6 pc),LOTTE乐天 奶油蛋黄派 (6枚),Snacks & Desserts
lotte koala biscuit chocolate flavor,乐天小熊饼干 巧克力味,Snacks & Desserts
lotte koala biscuit strawberry flavor - 195g,乐天 小熊饼干 草莓味 195g,Snacks & Desserts
lotte pepero chocolate filled stick,乐天 Pepero巧克力棒,Snacks & Desserts
marukin baked cake roll - 295g,MARUKIN丸金 千层卷蛋糕 295g,Snacks & Desserts
marukin baum sliced cake,MARUKIN丸金 切片千层蛋糕,Snacks & Desserts
marukin muffin - 255g,Marukin 家庭小蛋糕 北海道产牛乳 255g,Snacks & Desserts
marukin sliced cake chocolate flavor,切片千层糕 巧克力味,Snacks & Desserts
master kong 3 & 2 roll chocolate flavor,康师傅3+2夹心卷 巧克力味,Snacks & Desserts
meiji almond ball chocolate,Meiji明治 杏仁巧克力豆,Snacks & Desserts
meiji apollo biscuit strawberry chocolate flavor,Meiji明治 草莓巧克力饼干,Snacks & Desserts
meiji baby chocolate beans - 102g,Meiji明治 BABY巧克力豆 102g,Snacks & Desserts
meiji baked wheat biscuit kinokono yama flavor,Meiji明治 草菇巧克力饼干,Snacks & Desserts
meiji baked wheat biscuit takenoko no sato chocolate flavor - 70g,Meiji明治 笋子巧克力饼干 70g,Snacks & Desserts
meiji black chocolate,Meiji明治 钢琴黑巧克力,Snacks & Desserts
meiji chelsea candy butter flavor,Meiji明治 雀儿喜糖 奶油味,Snacks & Desserts
meiji chelsea candy yogurt flavor,Meiji明治 雀儿喜糖 乳酪味,Snacks & Desserts
meiji milk chocolate - 50g,Meiji明治 钢琴牛奶黑巧克力 50g,Snacks & Desserts
meiji panda chocolate filling cookie - 60g,Meiji明治 熊猫巧克力夹心饼干 60g,Snacks & Desserts
meiji panda cookie milk cream filling - 60g,Meiji明治 熊猫牛奶夹心饼干 60g,Snacks & Desserts
meiji panda cookie strawberry filling - 60g,Meiji明治 熊猫草莓夹心饼干 60g,Snacks & Desserts
meiji yan yan dipping sticks chocolate & strawberry double cream,Meiji明治 YANYAN巧克力草莓酱幸运脆棒,Snacks & Desserts
meiji yan yan dipping sticks chocolate flavor,Meiji明治 YANYAN巧克力幸运脆棒,Snacks & Desserts
meiji yan yan dipping sticks strawberry flavor,Meiji明治 YANYAN草莓酱幸运脆棒,Snacks & Desserts
meiji yan yan dipping sticks vanilla flavor - 57g,Meiji明治 YANYAN幸运脆棒 香草味 57g,Snacks & Desserts
morinaga hi chew candy mixed flavor - 50g,Hi Chew 果汁糖 综合口味 50g,Snacks & Desserts
nabisco oreo cookie matcha flavor -154g (24 count),奥利奥 夹心饼干 抹茶蛋糕味 154g (24枚),Snacks & Desserts
nestle kitkat black mini biscuit - 5.1oz,雀巢 黑巧克力饼干 5.1oz,Snacks & Desserts
nestle kitkat rich mini biscuit green tea flavor - 4.7oz,雀巢 特浓绿茶巧克力饼干 4.7oz,Snacks & Desserts
nestle kitkat salty lychee mini biscuit - 127g,雀巢 威化饼干 咸荔枝味 127g,Snacks & Desserts
nissin ciscos crisp biscuit milk chocolate flavor,日清Cisco 牛奶巧克力脆饼,Snacks & Desserts
nori maki arare rice cracker,海苔卷,Snacks & Desserts
oishi potato chips sweet & spicy flavor - 50g,上好佳 田园甜辣薯片 50g,Snacks & Desserts
oishi potato chips tomato flavor - 50g,上好佳 薯片 田园番茄味 50g,Snacks & Desserts
oishi prawn crackers - 40g (12 packs),上好佳 鲜虾条 40g,Snacks & Desserts
oishi shrimp flakes,上好佳 鲜虾片,Snacks & Desserts
pei tien 99 energy bar (eff yolk flavor),北田 能量棒 蛋黄味,Snacks & Desserts
pocky double rich matcha - 58g,POCKY百奇 特浓抹茶涂抹饼干棒 58g,Snacks & Desserts
qiao da niang vegan beef tripe spicy flavor - 18g (20 pc),巧大娘 素毛肚 麻辣味 18g (20包),Snacks & Desserts
qq gummies mixed flavor,QQ果汁糖 综合口味,Snacks & Desserts
rock sugar (1 bag),手工冰糖 (1袋),Snacks & Desserts
sabri samurai cookie milk egg flavor (8 pc),莎布蕾 武士曲奇 牛奶鸡蛋羹味 (8枚),Snacks & Desserts
sachima original flavor,原味沙琪玛,Snacks & Desserts
shiguangyouran sesame spicy bean curd - 145g,食光悠然 芝麻大辣串 145g,Snacks & Desserts
somoving traditional yogurt popsicle original flavor - 480g,好感冻 老酸奶冰棍 原味 480g,Snacks & Desserts
somoving yogurt popsicle yogurt flavor,好感冻 益生菌酸奶棒 酸奶味,Snacks & Desserts
south word brand brown candy 400g,南字牌 冰片糖 400g,Snacks & Desserts
sunity dessert hot pot (matcha flavor),生和堂 点翠抹茶甜品火锅,Snacks & Desserts
sunity dessert hot pot black tea flavor,生和堂 红茶奶苏甜品火锅,Snacks & Desserts
sunity dessert hot pot cocoa flavor,生和堂 可可慕桃甜品火锅,Snacks & Desserts
taisun mixed congee (6 pc),泰山八宝粥 (6个),Snacks & Desserts
taiwan peitien hello kitty grains rice roll egg yolk flavor - 160g,台湾北田 HELLO KITTY 谷物米卷 蛋黄口味 160g,Snacks & Desserts
thailand flavor rice snacks - 75g,泰国风味炒米 75g,Snacks & Desserts
three squirrel grandma sweet yogurt yellow peach sago flavor - 300g,三只松鼠 奶奶甜 酸奶黄桃西米露 300g,Snacks & Desserts
three squirrel nuts series pecan nuts,三只松鼠 碧根果仁,Snacks & Desserts
three squirrel roasted cashew,三只松鼠 炭烧腰果,Snacks & Desserts
three squirrels dried mango - 116g,三只松鼠 芒果干 116g,Snacks & Desserts
tian fu ming pin hot pot fish skin chips - 4.23oz,天富名品 火锅炸鱼皮 120g,Snacks & Desserts
tohato corn puff original flavor - 45g,东鸠 奶油玉米果 45g,Snacks & Desserts
toms almond honey butter flavor,韩国蜂蜜黄油杏仁,Snacks & Desserts
toms almond wasabi flavor,韩国芥末杏仁,Snacks & Desserts
toofy duck duck neck (1 pack),颓废鸭 麻辣鸭脖 (1包),Snacks & Desserts
toofy duck duck wing (1 pack),颓废鸭 麻辣鸭翅 (1包),Snacks & Desserts
uha extra milky candy - 105g,悠哈 特浓牛奶糖 105g,Snacks & Desserts
uncle yu fish roe ball original flavor,渔家翁 鱼籽蛋/鱼仔蛋 原味,Snacks & Desserts
uncle yu fish roe ball spicy flavor,渔家翁 鱼籽蛋/鱼仔蛋 香辣味,Snacks & Desserts
uncle yu shrimp scallops spicy flavor,渔家翁 虾夷扇贝 香辣味,Snacks & Desserts
ve wong prince noodle bacon flavor,台湾味王 小王子干脆面 培根味,Snacks & Desserts
ve wong prince noodle original flavor,台湾味王 小王子干脆面 原味,Snacks & Desserts
ve wong prince noodle seaweed flavor,台湾味王 小王子干脆面 海荅味,Snacks & Desserts
want want hot kid cookie ball honey flavor,旺仔小馒头 蜂蜜味,Snacks & Desserts
want want hot kid cookie ball milk flavor - 210g,旺旺 旺仔小馒头 特浓牛奶味 210g,Snacks & Desserts
want want hot-kid cookie ball honey flavor - 210g,旺旺 旺仔小馒头 蜂蜜味 210g,Snacks & Desserts
want want jelly mixed flavor -750g,旺旺 维多粒吸吸果冻 混合装 750g,Snacks & Desserts
want want potato twists tomato flavor - 70g,旺旺 浪味仙 番茄味 70g,Snacks & Desserts
want want potato twists vegatables flavor - 42g,旺旺 浪味仙 田园蔬菜味 42g,Snacks & Desserts
want want rice crackers,旺旺 仙贝 92g,Snacks & Desserts
want want rice crackers - 520g,旺旺 仙贝 520g,Snacks & Desserts
want want rice crackers original flavor - 60g,旺旺小小酥 原味 60g,Snacks & Desserts
want want shelly senbei rice cracker - 520g,旺旺雪饼 520g,Snacks & Desserts
wasabi peas 9oz,韩国芥末豌豆 9oz,Snacks & Desserts
wei long beancurd sheet spicy flavor - 180g,卫龙 香辣腐竹 180g,Snacks & Desserts
wei long da mian jin - 102g,卫龙 大面筋辣条 102g,Snacks & Desserts
wei long dried beancurd - 60g,卫龙 亲嘴豆皮 60g,Snacks & Desserts
wei long fried stinky tofu spicy - 120g,卫龙 臭豆腐 120g,Snacks & Desserts
wei long hot konjac spicy flavor - 350g,卫龙 魔芋爽 香辣味 350g,Snacks & Desserts
wei long little spicy fish - 150g,卫龙 小鱼 香辣味 150g,Snacks & Desserts
wei long mini hotstrip spicy - 312g,卫龙 小面筋 香辣味 312g,Snacks & Desserts
white rabbit creamy candy - 108g,大白兔 奶糖 原味 108g,Snacks & Desserts
ya si jia chadian cake,雅思嘉 茶点小厨蛋糕,Snacks & Desserts
yan ting yu fu sausage snacks corn flavor - 28g (20 pc),炎亭 渔夫鱼肠 玉米味 28g (20支/盒),Snacks & Desserts
yan ting yu fu sausage snacks spicy flavor,炎亭 渔夫鱼肠 香辣味,Snacks & Desserts
yogurt juice popsicle mixed flavor,乳酸棒棒冰 综合口味,Snacks & Desserts
zhen xiang vegetarian jerky beef flavor 80g,禛香 禛香肥牛 大豆素肉 牛肉味 80g,Snacks & Desserts
afu centella moisturizing pure gel - 125ml,阿芙积雪草保湿纯露 125ml,Hair & Skin Care
afu essential oil body lotion - 500ml,阿芙 晨露玫瑰精油身体乳 500ml,Hair & Skin Care
afu rosemary verbenone hydrosol - 125ml,阿芙 马鞭草酮迷迭香马迷纯露 125ml,Hair & Skin Care
all smile make up cotton,All Smile 化妆棉,Hair & Skin Care
australia cemoy 21 aurora good night essence 42ml (21 pack),澳洲Cemoy 21 极光晚安精华液 42ml (21包),Hair & Skin Care
australia unichi birds nest essence (60 capsules),澳洲Unichi 燕窝精华胶囊 (60粒),Hair & Skin Care
bai mei yi ren toothpaste powder - 50g,佰魅伊人 洁牙粉洗牙粉 50g,Hair & Skin Care
banila co clean it zero makeup remover - 100ml,韩国BANILA CO芭妮兰 卸妆膏 100ml,Hair & Skin Care
bcl saborino good night mask daisy orange (28 pc),BCL SABORINO 雏菊橘子晚安面膜 (28枚),Hair & Skin Care
biken yuzu essential oil toothpaste - 70g,BIKEN美健 YUZU精油牙膏 70g,Hair & Skin Care
bioderma makeup remover - 500ml,贝德玛 卸妆水粉水 500ml,Hair & Skin Care
biore cleansing pore & blackhead nose patch (10 pc),花王碧柔 清洁毛孔去黑头鼻贴 (10片),Hair & Skin Care
biore refreshing water sunscreen spf 50 - 50g,碧柔 清爽水感防晒霜 SPF50+ PA++++ 50g,Hair & Skin Care
bouncia body soap - 550ml,COW 牛乳石碱Bouncia浓密泡沫沐浴露 550ml,Hair & Skin Care
bouncia body soap rose scent - 550ml,COW牛乳石碱 Bouncia浓密泡沫沐浴露 玫瑰花香,Hair & Skin Care
creer beaute versailles rose deep white transparent mask honey & peach flavor,CREER BEAUTE 凡尔赛玫瑰 深层白透明面膜,Hair & Skin Care
creer beaute versailles rose moisturizing elasticity mask red rose flavor,CREER BEAUTE 凡尔赛玫瑰 润透亮弹力保湿面膜,Hair & Skin Care
cure gentle exfoliating deep cleansing gel 250g,Cure 温和去角质深层清洁啫喱 250g,Hair & Skin Care
d. jart tijiating green pill anti-sensitive moisturizing calming mask (5 sheets),Dr.Jart+蒂佳婷 绿药丸抗敏补水镇定面膜 (5片),Hair & Skin Care
daiso er whitening emulsion - 120ml,DAISO大创 ER美白乳液 120ml,Hair & Skin Care
daiso er whitening emulsion - 30ml,DAISO大创 ER美白乳液 30ml,Hair & Skin Care
daiso makeup sponge puff value pack (10 pc),Daiso 化妆棉 (10个),Hair & Skin Care
daiso special cleaning agent - 80ml,DAISO大创 粉扑专用清洗剂 80ml,Hair & Skin Care
daiso special cleaning agent for brushes - 150ml,DAISO大创 刷具专用清洗剂 150ml,Hair & Skin Care
daiso urglam contour v face three-dimensional repair stick black color,DAISO 大创URGLAM 轮廓V脸立体修容棒 黑色,Hair & Skin Care
derfriend brightening rejuvenating solution - 60ml,蝶芙兰 银胖子熊果苷烟酰胺面部精华液 60ml,Hair & Skin Care
dermatix silicone gel for scar reduction - 15g,DERMATIX 舒痕胶 15g,Hair & Skin Care
dhc medicated olive oil lip care cream,DHC 橄榄油保湿润唇膏,Hair & Skin Care
dhc vitamin c (120 capsules),DHC 维生素C (120粒),Hair & Skin Care
dr. ci labo dr. cheng ye pore convergence water - 100ml,Dr.Ci:Labo城野医生 毛孔收敛水 100ml,Hair & Skin Care
dr. jart tijiating blue pill hydration mask (5 sheets),Dr.Jart+蒂佳婷 蓝药丸深层补水强效保湿面膜 (5片),Hair & Skin Care
eltamd foaming facial cleanser - 207ml,EltaMD 氨基酸清洁保湿泡沫洗面奶 207ml,Hair & Skin Care
etude house lovely hair band white color (1 pc),韩国ETUDE HOUSE 爱丽小屋 可爱猫耳朵发带 (1枚),Hair & Skin Care
eve pain relieve tablets (60 pc),日本白兔制药 EVE生理期止痛片 (60片),Hair & Skin Care
fau centella asiatica water concealer repair black tube bb cream - 30g,FAU 积雪草再生水光遮瑕修复小黑管BB霜 30g,Hair & Skin Care
florasis flowers galaxie lipstick,花西子 星穹口红,Hair & Skin Care
florasis gorgeous peach blossom powder,花西子 玉女桃花轻蜜粉,Hair & Skin Care
florasis lotus clarifying & luminous cc cushion luminous,花西子 玉容睡莲气垫CC霜 水光版,Hair & Skin Care
florasis lotus clarifying cc cushion cover,花西子 玉容睡莲气垫CC霜 遮瑕版,Hair & Skin Care
florasis peony sculpting contour palette & f-light sculpting brush,花西子 洛花弄影修容盘与花浅染修容刷,Hair & Skin Care
florasis rouge blush cream 01 peony rosy blush,花西子 胭脂腮红膏 01 醉红潮,Hair & Skin Care
florasis sculpting brush,花西子 花浅染腮红刷,Hair & Skin Care
foellie eau de bijou inner perfume - 5ml,FOELLIE 私处香水 BIJOU玫瑰香 5ml,Hair & Skin Care
formula of beauty coconut oil body wash - 355ml,韩国Formula of Beauty 粉椰子油沐浴露 355ml,Hair & Skin Care
fujiko pon pon powder,FUJIKO PON PON 头发蓬松蓬蓬粉 油头细软发救星,Hair & Skin Care
healthy care propolis 2000 (200 capsules),Healthy Care 蜂胶胶囊 200粒,Hair & Skin Care
house of rose oh baby rose exfoliating scrub - 350g,HOUSE OF ROSE Oh Baby 玫瑰去角质磨砂膏,Hair & Skin Care
hu qing yu tang camellia flowers brighten skin & moisturizing mask - 23ml (5 pc),胡庆余堂 山茶花亮肤滋润面膜盒装 23ml (5片),Hair & Skin Care
hu qing yu tang ganoderma rejuvenating eye serum set - 18ml (2 count),胡庆余堂 灵芝赋活修护眼精华套装 18ml (2支/盒),Hair & Skin Care
innisfree green tea seed extract water extract - 80ml,韩国Innisfree 悦诗风吟 绿茶籽精萃水分菁露 80ml,Hair & Skin Care
ins nano crystal essential oil aromatherapy set citrine w. shangri-la essential oil - 20ml,ins 纳米水晶精油香薰套装 黄水晶配香格里拉精油,Hair & Skin Care
japan bb laboratories repairing moisturizing mask - 175g,日本BB LABORATORIES 修复补水复活草面膜,Hair & Skin Care
jayjun 3-step water injectable black mask (10 per box),JAYJUN 3-STEP 水光针剂黑面膜盒装 (10片),Hair & Skin Care
jm solution deep sea bomb first aid moisturizing mask (10 pc),JM Solution 深海炸弹急救补水保湿面膜 (10片),Hair & Skin Care
jm solution facial mask first aid amino acid (10 pc external use only),"JM Solution 急救氨基酸针剂面膜 (10片, 仅外用)",Hair & Skin Care
jm solution first aid vitamin whitening ampoule mask (10 pc),JM Solution 急救维他命美白安瓶面膜 (10 片),Hair & Skin Care
jm solution pureness firming up mask (10 pc),JM Solution MaMa婴儿纯净紧致面膜 (10片),Hair & Skin Care
k skin 2 in1 hair wand,K skin 2合1直发夹,Hair & Skin Care
kao curel foaming wash - 150ml,KAO花王 CUREL珂润 润浸保湿洁颜泡沫 150ml,Hair & Skin Care
kao prettia bubble hair dye cool ash color,KAO花王 PRETTIA植物泡沫染发剂 混血风系列 白金浅驼色,Hair & Skin Care
kao steam soothing eye mask lavender fragrance (12 pc),KAO花王 蒸汽舒缓眼罩 薰衣草香 (12枚),Hair & Skin Care
kao steam soothing eye mask rose fragrance (12 pc),KAO花王 蒸汽舒缓眼罩 玫瑰花香 (12枚),Hair & Skin Care
kao steam soothing eye mask yuzu fragrance (12 pc),KAO花王 蒸汽舒缓眼罩 柚子香 (12枚),Hair & Skin Care
kingdom cares hair straightening comb,金稻 直发梳,Hair & Skin Care
kingdomcares electrical facial brush blue color,金稻 硅胶电动洗脸仪 蓝色,Hair & Skin Care
kiribai kairo hot warming heating pad (10 pc),KIRIBAI桐灰化学 小白兔金装暖贴暖宝宝 (10片),Hair & Skin Care
kiss me heroine make long & curl mascara pure black,KISS ME 花漾美姬防水型极致纤长卷翘睫毛膏 漆黑,Hair & Skin Care
kobayashi medicine for sarasatirangerie cleanser,小林制药 女性内衣洗衣液 内裤清洗剂 洗涤剂去血渍,Hair & Skin Care
korea vt cica anti-acne moisturizing soothing mask 10pcs,韩国VT CICA老虎贴祛痘补水保湿舒缓面膜 10片,Hair & Skin Care
korean salon masil masilian 8 seconds hair mask - 200ml,韩国沙龙Masil 玛丝兰密丝 8秒发膜 200ml,Hair & Skin Care
library of flowers sophora radix body wash - 400ml,半亩花田 苦参沐浴露 400ml,Hair & Skin Care
lion pair acne cream,Lion狮王PAIR ACNE W药用祛痘暗疮膏,Hair & Skin Care
little dream garden foot mask,半亩花田 烟酰胺足膜,Hair & Skin Care
lucky trendy moisturizing exfoliating hand mask (1 pair),LUCKY TRENDY 补水保湿去角质手膜 (1对),Hair & Skin Care
lucky trendy sponge big hair volume (8 pc),LUCKY TRENDY 海绵天使美人大发卷 (8枚),Hair & Skin Care
mandom gentle eye & lip makeup remover - 145ml,MANDOM曼丹 温和即净眼唇卸妆液 145ml,Hair & Skin Care
maputi intimate soap water cleanser - 120ml,MAPUTI 私处神仙水清洁液 120ml,Hair & Skin Care
mba hair enhancer - 20ml,MBA 增发神器生发液 20ml,Hair & Skin Care
mediheal n.m.f moisturizing reservoir mask pack of 10pcs,mediheal美迪惠尔(可莱丝) n.m.f补水保湿针剂水库面膜盒装 10片,Hair & Skin Care
melrose organic essential greens - 200g,澳洲Melrose 麦萝氏绿植精粹粉全能绿瘦子 200g,Hair & Skin Care
mise en scene color primer,韩国爱茉莉 纯植物泡沫 PR褪色剂,Hair & Skin Care
mise en scene hello bubble foam hair dye chocolate brown color,韩国爱茉莉 纯植物泡沫染发剂 6N巧克力棕,Hair & Skin Care
mise en scene hello bubble foam hair dye dusty ash color,韩国爱茉莉 纯植物泡沫染发剂 6A亚麻烟灰,Hair & Skin Care
mise en scene hello bubble foam hair dye sunset orange color,韩国爱茉莉 纯植物泡沫染发剂 8O日落橙脏橘色,Hair & Skin Care
mise en scene hello bubble form hair dye dark chocolate color,韩国爱茉莉 纯植物泡沫染发剂 3NT深巧克力色,Hair & Skin Care
mise en scene hello bubble hair foam color matte gold,韩国爱茉莉 纯植物泡沫染发剂 8MG哑光金,Hair & Skin Care
my beauty tool exfoliating jellyfish silicon,爱丽小屋洗脸刷,Hair & Skin Care
naris pore shrinkage toner - 200ml,娜丽丝 毛孔收缩去角质爽肤水 200ml,Hair & Skin Care
nature republic soothing & moisture aloe vera soothing gel - 300ml,Nature Republic自然乐园 补水芦荟胶 300ml,Hair & Skin Care
naturie coix seed moisturizing face cream 180g,NATURIE 薏仁保湿啫喱面霜 180g,Hair & Skin Care
naturie whitening moisture almighty barley water lotion - 500ml,NATURIE 美白保湿全能薏仁水化妆水 500ml,Hair & Skin Care
neogen dermalogy wine lift pha gauze peeling,Neogen 红酒萃取去角质磨砂膏,Hair & Skin Care
neogen dermalogy wipe type exfoliating clean cotton gauze lemon fragrant,Neogen Dermalogy 擦拭型去角质清洁纯棉纱布 柠檬味,Hair & Skin Care
oliveyoung ultra thin hidden acne sticker (84 stickers),OLIVEYOUNG 超薄隐性痘痘贴 (84 贴),Hair & Skin Care
papa recipe bombee black honey mask (10 sheets),韩国PAPA RECIPE 春雨卢卡蜂蜜罐蜂胶双倍补水黑面膜 (10片),Hair & Skin Care
papa recipe bombee whitening honey mask (10 sheets),PAPA RECIPE 春雨蜂蜜美白保湿营养面膜 (10片),Hair & Skin Care
pdc wafood sake lees facial mask,范冰冰热推 PDC 酒粕面膜,Hair & Skin Care
pigeon baby antibacterial soft laundry soap 120g,日本 贝亲 婴儿抑菌柔护洗衣皂120g,Hair & Skin Care
q-tips (500 count),棉签 (500支),Hair & Skin Care
ren he chitosan wound protecting gel - 20g,仁和 壳聚糖护创凝胶祛疤膏 去疤痕 修复烫伤疤及妊娠纹 20g,Hair & Skin Care
ren he foot pads (50 pc),仁和 老北京足贴 (50贴),Hair & Skin Care
ren he medical cold facial compress - 25ml (5 count),仁和 医用面部冷敷贴 25ml (5片/盒),Hair & Skin Care
ren he pads (10 pc),仁和 远红外肚脐贴1盒 (10片),Hair & Skin Care
ren he stomache pads (30 pc),仁和 艾脐贴南怀瑾肚脐贴 (30贴),Hair & Skin Care
ren he wound recovering cream,仁和 伤口护理软膏,Hair & Skin Care
rohto lycee eye drops - 8ml,乐敦Lycee 小粉花防干涩眼药水 8ml,Hair & Skin Care
rohto melano cc medicinal stains intensive measures essence - 23g,ROHTO乐敦 MELANO CC嫩白祛暗沉祛痘印淡斑 药用美白精华美容液,Hair & Skin Care
rongjin pharmaceutical diet maru anti-edema & anti-water pills (10 pc),荣进制药 DIET MARU 消水肿消水丸 (10包),Hair & Skin Care
rou li jie cosmetic special cotton tissues (80 pc),柔丽洁 抽取式棉柔巾 (80抽一包),Hair & Skin Care
rou li jie cotton dry wet towel (50 pc),柔丽洁 一次性压缩洗脸巾 (50枚),Hair & Skin Care
ryo scalp deep cleansing rinse medium dry hair,韩国RYO吕 控油祛屑养发护发素 中干性发质适用,Hair & Skin Care
ryoe anti-hair loss shampoo for normal & dry scalp - 400ml,韩国RYOE吕 紫色防脱滋养中干性发质洗发水 400ml,Hair & Skin Care
ryoe hair brown strenghener shampoo - 500ml,RYOE吕 滋养强健发根丰盈秀发洗发水 500ml,Hair & Skin Care
ryoe red repair shampoo - 500ml,韩国RYOE吕 红色修复养护洗发水 500ml,Hair & Skin Care
san jiu granule for cold flu,三九 感冒灵颗粒,Hair & Skin Care
santen eye drops - 12ml,SANTEN参天 去红血丝红玫瑰眼药水 12ml,Hair & Skin Care
serious skin care squalane beauty oil - 50ml,言之有物 植物角鲨烷美容油 50ml,Hair & Skin Care
serious skin care treatment oil hydrating mask,DIARY言之有物 水油调理保湿面膜 锁水膜,Hair & Skin Care
shiseido anessa perfect uv sunscreen,SHISEIDO资生堂 ANESSA安耐晒 超防水防晒霜 金瓶,Hair & Skin Care
shiseido eyelash curler,SHISEIDO资生堂 睫毛夹,Hair & Skin Care
shiseido fino efficient soak repairing hair mask damaged hair dedicated 230g,SHISEIDO资生堂 fino高效浸透修复发膜 受损发专用 230g,Hair & Skin Care
shiseido prepare eyebrow razor (3 pc),SHISEIDO资生堂 PREPARE女用专用修眉刀 (3把),Hair & Skin Care
shiseido senka perfect whip face wash - 120g,SHISEIDO资生堂 SENKA洗颜专科 新版超微米浓密泡沫洁面乳 120g,Hair & Skin Care
shiseido tsubaki hair mask,SHISEIDO资生堂 TSUBAKI金耀沙龙级瞬暖护芯0秒发膜,Hair & Skin Care
spa treatment has aging care sheet (60 pc),SPA TREATMENT HAS 干细胞蛇毒红眼膜贴 (60贴),Hair & Skin Care
ssp hythiol c plus l cysteine whitening beauty (180 tablets),白兔牌 HYTHIOL-C+祛斑祛痘印美白丸 (180粒/盒),Hair & Skin Care
swisse manuka australian mud film improving dark spot - 70g,澳洲Swisse 麦卢卡改善暗黄血橙小黄泥膜 70g,Hair & Skin Care
swisse manuka soothing repair green tea green tea mask - 70g,澳洲Swisse 麦卢卡舒缓修复抹茶小绿泥膜 70g,Hair & Skin Care
taisho pharmaceutical mouth inflammation sticker (10 pc),大正制药 口腔溃疡贴片 (10片),Hair & Skin Care
thailand ray makeup bud silk golden repair brightening moisturizing mask (10 pc),泰国RAY 妆蕾 蚕丝金色修复提亮保湿面膜 (10片),Hair & Skin Care
toyo life cure natural aqua gel,TOYO LIFE东洋 CURE活性化水素去角质凝胶,Hair & Skin Care
unicharm silcot cotton puff (82 pc),UNICHARM尤妮佳 化妆棉 丝滑多功能 (82枚),Hair & Skin Care
unicharm silcot uruuru sponge facial cotton (40 pc),UNICHARM尤妮佳 化妆棉 1/2省水超吸收 (40枚),Hair & Skin Care
unny club mild cleansing water - 500ml,UNNY悠宜 济州岛温泉卸妆水 500ml,Hair & Skin Care
